{
  "id": "MYSAAS-001",
  "projectId": "my-saas",
  "repoId": "repo-main",
  "title": "修复登录页表单校验问题",
  "goal": "修复登录页表单校验 bug，并补充相关测试",
  "constraints": [
    "必须通过 Codex worker 执行代码修改",
    "不得直接修改 main 分支"
  ],
  "stage": "intake",
  "needsUserDecision": false,
  "userDecisionKind": null,
  "userDecisionReason": "",
  "blockedReasonKind": null,
  "deliveryClosure": null,
  "codexSession": null,
  "repoRef": {
    "repoPath": "/repos/my-saas",
    "branch": "feature/MYSAAS-001",
    "worktree": null
  },
  "artifacts": {
    "plan": null,
    "codexRunRecord": null,
    "codexSummary": null,
    "review": null,
    "testResult": null
  },
  "acceptanceChecks": [
    "review 通过",
    "输出变更摘要"
  ],
  "history": [],
  "createdAt": "2026-03-16T00:00:00Z",
  "updatedAt": "2026-03-16T00:00:00Z"
}
